{
  "record_type": "full_studio_loop_in_memory_result",
  "contract_version": "V0",
  "source_report": {
    "path": "docs/control-plane/fixtures/studiopilot_packets/valid/valid_execution_report_docs.json",
    "task_id": "SP202-DOCS-001",
    "source_report_id": "SP202-DOCS-001",
    "source_task_id": "SP202-DOCS-001"
  },
  "decision": "defer",
  "delta_status": "TESTED",
  "snapshot_status": "TESTED",
  "current_state_preview_status": "TESTED",
  "mission_candidate_status": "TESTED",
  "operator_inbox_status": "TESTED",
  "humangate_decision_status": "TESTED",
  "authorized_action_plan_status": "TESTED",
  "semi_auto_loop_status": "TESTED",
  "execution_performed": false,
  "codex_execution_performed": false,
  "persistence_performed": false,
  "current_state_modified": false,
  "inbox_persisted": false,
  "claim_posture": "NO_CLAIM_ALLOWED",
  "no_global_ready_verdict": true
}
